{
  "schema_version": "secure-bench-phase14-isolation-v1",
  "case_id": "v4-case-048",
  "mechanism": "bubblewrap-minimal-read-only-runtime-unshare-net",
  "namespace_scope": "fresh-bwrap-unshare-net-per-case",
  "interfaces": [
    "lo"
  ],
  "outbound_connectivity": "blocked",
  "probe_target": "1.1.1.1:53",
  "scanner_invoked_after_probe": true,
  "ai_environment": "absent-after-env-clear"
}
